{
  "code": "sample-center",
  "name": "Sample Center",
  "domain": "sample.example.com",
  "features": {
    "keyTakeaways": true,
    "summaryVideo": true,
    "fullVideo": true,
    "detailedNotes": false,
    "activity": false
  },
  "admins": ["admin@example.com"],
  "sheetId": "spreadsheet-id-if-applicable",
  "theme": {
    "primary": "#0d6efd",
    "secondary": "#6c757d"
  },
  "status": "active",
  "timestamp": "2025-04-21T05:37:50-07:00"
}
